{
  "$schema": "https://json-schema.org/draft/2020-12/schema",
  "$id": "https://fpl-lab.local/schemas/decision_signals.json",
  "title": "Decision signal",
  "type": "object",
  "additionalProperties": false,
  "required": [
    "signal_id",
    "interpretation",
    "observed_at",
    "available_at",
    "provenance"
  ],
  "properties": {
    "signal_id": {
      "type": "string"
    },
    "claim_ids": {
      "type": "array",
      "items": {
        "type": "string"
      }
    },
    "interpretation": {
      "type": "string"
    },
    "player_uid": {
      "type": "string"
    },
    "published_at": {
      "$ref": "../_defs.json#/$defs/iso_datetime"
    },
    "observed_at": {
      "$ref": "../_defs.json#/$defs/iso_datetime"
    },
    "effective_at": {
      "$ref": "../_defs.json#/$defs/iso_datetime"
    },
    "finalised_at": {
      "$ref": "../_defs.json#/$defs/iso_datetime"
    },
    "available_at": {
      "$ref": "../_defs.json#/$defs/iso_datetime"
    },
    "provenance": {
      "$ref": "../_defs.json#/$defs/provenance"
    }
  }
}
