{
  "signal_id": "sig_1",
  "claim_ids": [
    "cl_1"
  ],
  "interpretation": "Availability uncertain",
  "player_uid": "pl_x",
  "observed_at": "2026-07-21T12:00:00Z",
  "available_at": "2026-07-21T12:00:00Z",
  "provenance": {
    "source_ids": [
      "fpl-official-endpoints"
    ],
    "transformation_version": "0.1.0",
    "ruleset_id": "2026-27-v0.1"
  },
  "published_at": "2026-07-21T11:30:00Z"
}
